[
  {
    "id": "inc_mock_001",
    "severity": "high",
    "status": "open",
    "title": "Booking List frontend loop detected",
    "description": "One session exceeded the planned Booking List read threshold. Guard would throttle session and create follow-up task.",
    "module": "schedule",
    "route": "/company/booking-list",
    "endpoint": "/api/bookings/list",
    "companyId": "comp_mock_041",
    "userId": "usr_mock_118",
    "sessionId": "sess_mock_loop_001",
    "actionKey": null,
    "triggerType": "frontend_loop_detected",
    "guardAction": "quarantine_session",
    "requestCount": 137,
    "errorCount": 0,
    "latencyMs": 420,
    "correlationId": "corr_mock_001",
    "traceRef": "sentry:mock-booking-loop",
    "releaseVersion": "mock-release-2026.06.11",
    "startedAt": "2026-06-11T09:12:00Z",
    "lastSeenAt": "2026-06-11T09:13:20Z",
    "resolvedAt": null,
    "assignedTo": "dev_team",
    "resolutionNotes": null,
    "runtimeGuardPolicyKey": "runtime.guard.booking_list_frontend_loop"
  },
  {
    "id": "inc_mock_002",
    "severity": "warning",
    "status": "acknowledged",
    "title": "AI chat quota threshold exceeded",
    "description": "A user exceeded the mock AI request budget. Non-AI chat remains available.",
    "module": "chat",
    "route": "/company/chat",
    "endpoint": "/api/ai/chat",
    "companyId": "comp_mock_021",
    "userId": "usr_mock_044",
    "sessionId": "sess_mock_ai_002",
    "actionKey": "chat.message.complaint_detected",
    "triggerType": "ai_quota_exceeded",
    "guardAction": "throttle",
    "requestCount": 18,
    "errorCount": 0,
    "latencyMs": 980,
    "correlationId": "corr_mock_002",
    "traceRef": "logs:mock-ai-quota",
    "releaseVersion": "mock-release-2026.06.11",
    "startedAt": "2026-06-11T10:04:00Z",
    "lastSeenAt": "2026-06-11T10:06:00Z",
    "resolvedAt": null,
    "assignedTo": "support_ops",
    "resolutionNotes": null,
    "runtimeGuardPolicyKey": "runtime.guard.ai_chat_request_budget"
  },
  {
    "id": "inc_mock_003",
    "severity": "high",
    "status": "mitigated",
    "title": "Invoice export circuit opened",
    "description": "Repeated export timeouts would open a circuit and temporarily block new export jobs for the company.",
    "module": "invoices",
    "route": "/company/invoices",
    "endpoint": "/api/invoices/export",
    "companyId": "comp_mock_012",
    "userId": "usr_mock_007",
    "sessionId": "sess_mock_invoice_003",
    "actionKey": null,
    "triggerType": "timeout_threshold_exceeded",
    "guardAction": "open_circuit",
    "requestCount": 4,
    "errorCount": 4,
    "latencyMs": 30000,
    "correlationId": "corr_mock_003",
    "traceRef": "logs:mock-invoice-export-timeout",
    "releaseVersion": "mock-release-2026.06.11",
    "startedAt": "2026-06-11T08:40:00Z",
    "lastSeenAt": "2026-06-11T08:48:00Z",
    "resolvedAt": null,
    "assignedTo": "finance_dev",
    "resolutionNotes": "Mock mitigation: export feature limited for affected company.",
    "runtimeGuardPolicyKey": "runtime.guard.invoice_export_timeout_circuit"
  },
  {
    "id": "inc_mock_004",
    "severity": "warning",
    "status": "resolved",
    "title": "Media upload concurrency exceeded",
    "description": "Concurrent upload limit exceeded by one company. Additional uploads would be throttled.",
    "module": "media",
    "route": "/company/media",
    "endpoint": "/api/media/upload",
    "companyId": "comp_mock_033",
    "userId": "usr_mock_072",
    "sessionId": "sess_mock_media_004",
    "actionKey": null,
    "triggerType": "resource_quota_exceeded",
    "guardAction": "throttle",
    "requestCount": 12,
    "errorCount": 0,
    "latencyMs": 1200,
    "correlationId": "corr_mock_004",
    "traceRef": "logs:mock-media-upload",
    "releaseVersion": "mock-release-2026.06.11",
    "startedAt": "2026-06-11T07:20:00Z",
    "lastSeenAt": "2026-06-11T07:22:00Z",
    "resolvedAt": "2026-06-11T07:30:00Z",
    "assignedTo": "media_dev",
    "resolutionNotes": "Mock resolved after upload burst ended.",
    "runtimeGuardPolicyKey": "runtime.guard.media_upload_concurrency"
  }
]